{
  "contract_version": "remediate-code-step/v1alpha1",
  "step_kind": "present_report",
  "status": "complete",
  "prompt_path": "C:\\Code\\auditor-lambda\\.remediation-artifacts\\steps\\current-prompt.md",
  "run_id": "REMEDIATE-mpg3x6sx-ixhtua",
  "repo_root": "C:\\Code\\auditor-lambda",
  "artifacts_dir": "C:\\Code\\auditor-lambda\\.remediation-artifacts",
  "allowed_commands": [],
  "stop_condition": "Stop after presenting the remediation report summary.",
  "artifact_paths": {
    "current_prompt": "C:\\Code\\auditor-lambda\\.remediation-artifacts\\steps\\current-prompt.md",
    "final_report": "C:\\Code\\auditor-lambda\\remediation-report.md"
  }
}
